{
  "base_model_id": "cross-encoder/ms-marco-MiniLM-L6-v2",
  "base_model_license": "Apache-2.0",
  "base_model_revision": "233902d25c440f23af6f7d6e94d2946bac0bee0a",
  "config_hash": "sha256:960911ea788a47d16a5ec0f14d820c2c4bdd6f387d0224aaa740dc49071cc133",
  "config_id": "candidate-random-ablation-v1",
  "dataset_manifest_hash": "sha256:814e06ceba032871d1cac66cd4dd59177f4348c9928fdf417f2a2f3218a29525",
  "deterministic_mode": true,
  "early_stopping": {
    "enabled": true,
    "min_delta": 0.0001,
    "patience": 2
  },
  "effective_batch_size": 32,
  "gradient_accumulation_steps": 2,
  "hard_example_sources": [],
  "input_template_version": "enriched_v1",
  "label_mapping_version": "project_graded_v1",
  "learning_rate": 2e-05,
  "loss_name": "BinaryCrossEntropyLoss",
  "max_epochs": 3,
  "max_sequence_length": 256,
  "precision": "auto",
  "requested_hardware": "ml.g4dn.xlarge",
  "sampling_strategy": "random_only_v1",
  "schema_version": "1.0.0",
  "seed": 42,
  "warmup_ratio": 0.1
}
